<?xml version="1.0" encoding="UTF-8"?>
<!-- This example message is provided for illustrative purposes only. It has had no clinical validation nor is it guaranteed to be fully compliant with the written message specification. Where there are conflicts with the written message specification or schema, the specification or schema shall be considered to take precedence. -->
<query xmlns="urn:hl7-org:v3" xmlns:xsi="http://www.w3.org/2001/XMLSchema-instance" xsi:schemaLocation="urn:hl7-org:v3 ../../Schemas/QUPA_MT000003UK02.xsd">
	<historicDataIndicator>
		<!-- To indicate "Retrieve all historic information on requested parameters" -->
		<semanticsText>HistoricDataIndicator</semanticsText>
		<value code="1" codeSystem="2.16.840.1.113883.2.1.3.2.4.17.36"/>
	</historicDataIndicator>
	<person.id>
		<!-- NHS number -->
		<semanticsText>Person.id</semanticsText>
		<value root="2.16.840.1.113883.2.1.4.1" extension="9999999484"/>
	</person.id>
	<retrievalItem>
		<!-- To indicate retrieve all proxy details -->
		<semanticsText>Proxy</semanticsText>
	</retrievalItem>
</query>
